{
  "artifact_id": "V0_IPEC_WP3_THEOREM_RULE_CROSSWALK",
  "contract_id": "V0-IPEC-0.1",
  "version": "0.1",
  "date": "2026-07-19",
  "status": "WP3_CROSSWALK_FROZEN",
  "theorem_range": "T121-T156",
  "theorem_count": 36,
  "rule_count": 36,
  "unmapped_theorem_count": 0,
  "duplicate_primary_rule_count": 0,
  "records": [
    {
      "theorem_id": "T121",
      "canonical_name": "live_guard_has_a_live_token",
      "canonical_owner": "V0_OSAP_V1_3_0",
      "primary_rule_id": "IPEC.RULE.GUARD.001",
      "rule_ids": [
        "IPEC.RULE.GUARD.001"
      ],
      "supporting_theorem_ids": [],
      "diagnostic_codes": [
        "UNGUARDED_VALUE_CLAIM"
      ],
      "statement_sha256": "babb17eac963e89433881717373d9c989ea0438f68559359ba105593e4807557",
      "statement_hash_class": "DERIVED_PHASE1_NORMALIZATION",
      "claim_class": "PROVED_THEOREM",
      "conditional": false,
      "ownership_record_sha256": "a6d3f730b9d144527036013068c6ad9a9233fd5e8c7bfd743d83b10f38fc704e",
      "coverage_status": "BOUND",
      "typed_outcome_binding_status": "DEFERRED_TO_WP4",
      "crosswalk_record_sha256": "76ebad056a80e97a3544bce1e41ddfc37dc8dafa5a504cfc70e6e778efb2180b"
    },
    {
      "theorem_id": "T122",
      "canonical_name": "empty_all_of_prerequisite_family_is_vacuously_satisfied",
      "canonical_owner": "V0_OSAP_V1_3_0",
      "primary_rule_id": "IPEC.RULE.PREREQUISITE.001",
      "rule_ids": [
        "IPEC.RULE.PREREQUISITE.001"
      ],
      "supporting_theorem_ids": [],
      "diagnostic_codes": [
        "MISSING_PREREQUISITE"
      ],
      "statement_sha256": "f9fbfc75b7334c765f03a90c702e67d13a67c00bd00a56966da2e831d04b4e9b",
      "statement_hash_class": "DERIVED_PHASE1_NORMALIZATION",
      "claim_class": "PROVED_THEOREM",
      "conditional": false,
      "ownership_record_sha256": "dca17aa0ae091cd6d787d75ee3b039f62a035b77fa922d5cacb2c1f4e9991c18",
      "coverage_status": "BOUND",
      "typed_outcome_binding_status": "DEFERRED_TO_WP4",
      "crosswalk_record_sha256": "7f48637c3e8e4dd451ba36f5140c6461b4bdbe417dc07d9666eeefb951905783"
    },
    {
      "theorem_id": "T123",
      "canonical_name": "dle_implies_current_no_live_status",
      "canonical_owner": "V0_OSAP_V1_3_0",
      "primary_rule_id": "IPEC.RULE.DLE.001",
      "rule_ids": [
        "IPEC.RULE.DLE.001"
      ],
      "supporting_theorem_ids": [],
      "diagnostic_codes": [
        "DLE_CONFLICTS_WITH_LIVE_TOKEN"
      ],
      "statement_sha256": "fb907509c5f7c7710dd739cbfe7eb8a6aed6fbb38d10981012867e7f377b7a4b",
      "statement_hash_class": "DERIVED_PHASE1_NORMALIZATION",
      "claim_class": "PROVED_THEOREM",
      "conditional": false,
      "ownership_record_sha256": "e50f6a5b277b727c9bf42cd00148825058a9195f10793902d7284b1b10be51d7",
      "coverage_status": "BOUND",
      "typed_outcome_binding_status": "DEFERRED_TO_WP4",
      "crosswalk_record_sha256": "59870e138525eb6c95c8d379a67f1eb1ad4ad97a56454382b3c0d4c5c00aa154"
    },
    {
      "theorem_id": "T124",
      "canonical_name": "live_residual_obstructs_robust_relative_v0",
      "canonical_owner": "V0_OSAP_V1_3_0",
      "primary_rule_id": "IPEC.RULE.RESIDUAL.001",
      "rule_ids": [
        "IPEC.RULE.RESIDUAL.001"
      ],
      "supporting_theorem_ids": [],
      "diagnostic_codes": [
        "LIVE_RESIDUAL_OBSTRUCTS_ROBUST_RELATIVE_V0"
      ],
      "statement_sha256": "a8a434dacaaffd132bb762630e9ee01c50e9963938b970e24256faa9ada40d79",
      "statement_hash_class": "DERIVED_PHASE1_NORMALIZATION",
      "claim_class": "PROVED_THEOREM",
      "conditional": false,
      "ownership_record_sha256": "fcfd56874f656937bf85ab12cf81e5b23e71e33927f24a51028727b0299a1b9e",
      "coverage_status": "BOUND",
      "typed_outcome_binding_status": "DEFERRED_TO_WP4",
      "crosswalk_record_sha256": "007039215b932474a07122b4eadbd1ddef936427e57635ba408c7760a99b8187"
    },
    {
      "theorem_id": "T125",
      "canonical_name": "terminal_self_certificate_exposes_empty_internal_and_external_support",
      "canonical_owner": "V0_OSAP_V1_3_0",
      "primary_rule_id": "IPEC.RULE.OBSERVER.001",
      "rule_ids": [
        "IPEC.RULE.OBSERVER.001"
      ],
      "supporting_theorem_ids": [],
      "diagnostic_codes": [
        "TERMINAL_SELF_CERTIFICATE_NOT_EXHAUSTED"
      ],
      "statement_sha256": "d92314a732e2647ccf1246b8b7f03aa2e3558df8b08fcce65d8cdefc7dae7f55",
      "statement_hash_class": "DERIVED_PHASE1_NORMALIZATION",
      "claim_class": "PROVED_THEOREM",
      "conditional": false,
      "ownership_record_sha256": "2e2f8ba2ad3c5ad53546cab7d8e712604dab9899dd9b4c455d9f7bdd2ffbd1b2",
      "coverage_status": "BOUND",
      "typed_outcome_binding_status": "DEFERRED_TO_WP4",
      "crosswalk_record_sha256": "694acf4857be116bbcc6d62c94318530c369a5b8544ed782169b655a2eaba28a"
    },
    {
      "theorem_id": "T126",
      "canonical_name": "direct_branch_local_to_absolute_promotion_violates_the_firewall",
      "canonical_owner": "V0_OSAP_V1_3_0",
      "primary_rule_id": "IPEC.RULE.FIREWALL.001",
      "rule_ids": [
        "IPEC.RULE.FIREWALL.001"
      ],
      "supporting_theorem_ids": [],
      "diagnostic_codes": [
        "ABSOLUTE_RELATIVE_FIREWALL"
      ],
      "statement_sha256": "1a7731bf92d9272f3f51e33b80d8cf5669acf85d545f1e3dee0a0abb8c64c252",
      "statement_hash_class": "DERIVED_PHASE1_NORMALIZATION",
      "claim_class": "PROVED_THEOREM",
      "conditional": false,
      "ownership_record_sha256": "f6c68a3f26ef9c02d0bc079c6a7984f56f1d080ce3634e0c3ac5ee32ca6a9780",
      "coverage_status": "BOUND",
      "typed_outcome_binding_status": "DEFERRED_TO_WP4",
      "crosswalk_record_sha256": "6f138e47d472a07f671af70b416059ac274d9f8499302b0b076c8e836ddbc893"
    },
    {
      "theorem_id": "T127",
      "canonical_name": "closure_minimality",
      "canonical_owner": "V0_OSAP_V1_3_0",
      "primary_rule_id": "IPEC.RULE.CLOSURE.001",
      "rule_ids": [
        "IPEC.RULE.CLOSURE.001"
      ],
      "supporting_theorem_ids": [],
      "diagnostic_codes": [
        "PREREQUISITE_CLOSURE_NOT_LEAST"
      ],
      "statement_sha256": "65aab2064dc6d0a47652e2cba1813a8e65c9e4e174db6d343d7a145577950a54",
      "statement_hash_class": "UPSTREAM_CANONICAL_HASH",
      "claim_class": "PROVED_THEOREM",
      "conditional": false,
      "ownership_record_sha256": "fb40dad1a3275d7a09496d11079cb0ab1e9463e085f4f95cd340644f663bcdf4",
      "coverage_status": "BOUND",
      "typed_outcome_binding_status": "DEFERRED_TO_WP4",
      "crosswalk_record_sha256": "451cbaf879bfc127fcc503112875f034cf20e904bcb0311f0184d45d7a81fc95"
    },
    {
      "theorem_id": "T128",
      "canonical_name": "alternative_support_transparency",
      "canonical_owner": "V0_OSAP_V1_3_0",
      "primary_rule_id": "IPEC.RULE.SUPPORT.001",
      "rule_ids": [
        "IPEC.RULE.SUPPORT.001"
      ],
      "supporting_theorem_ids": [],
      "diagnostic_codes": [
        "ALTERNATIVE_SUPPORT_SELECTION_REQUIRED",
        "INVALID_ALTERNATIVE_SUPPORT_SELECTION"
      ],
      "statement_sha256": "d9979d741f79844b2ac39ec8a36020eb31afc601cf89cc6231d55f90995e1bae",
      "statement_hash_class": "UPSTREAM_CANONICAL_HASH",
      "claim_class": "PROVED_THEOREM",
      "conditional": false,
      "ownership_record_sha256": "af35410c2f0e119fbe34a99e94ab66b443640b7f504491e958b7a7bb4e7ca5d6",
      "coverage_status": "BOUND",
      "typed_outcome_binding_status": "DEFERRED_TO_WP4",
      "crosswalk_record_sha256": "898b84186e0a00a2305c812f9100541642e613f7b68c444c8598249ebdd430fd"
    },
    {
      "theorem_id": "T129",
      "canonical_name": "compatibility_preservation",
      "canonical_owner": "V0_OSAP_V1_3_0",
      "primary_rule_id": "IPEC.RULE.COMPATIBILITY.001",
      "rule_ids": [
        "IPEC.RULE.COMPATIBILITY.001"
      ],
      "supporting_theorem_ids": [],
      "diagnostic_codes": [
        "COMPATIBILITY_CONSTRAINT_VIOLATION",
        "ACTIVE_PROFILE_REGISTER_NOT_LIVE"
      ],
      "statement_sha256": "737cd617596ade973388e887213e2be9e83cde2722472296f977b8ec9d351713",
      "statement_hash_class": "UPSTREAM_CANONICAL_HASH",
      "claim_class": "PROVED_THEOREM",
      "conditional": false,
      "ownership_record_sha256": "0b3a9f8ce1208518cf329f01a76ce5e40724fbd7bde3b7b3ea475fa9a9788285",
      "coverage_status": "BOUND",
      "typed_outcome_binding_status": "DEFERRED_TO_WP4",
      "crosswalk_record_sha256": "c46b31b923ed0a6b72c1022b77acfa24cb7e2da05a8d103156b9146a04ad966a"
    },
    {
      "theorem_id": "T130",
      "canonical_name": "dimensional_readiness_soundness",
      "canonical_owner": "V0_OSAP_V1_3_0",
      "primary_rule_id": "IPEC.RULE.READINESS.001",
      "rule_ids": [
        "IPEC.RULE.READINESS.001"
      ],
      "supporting_theorem_ids": [],
      "diagnostic_codes": [
        "PROTOCOL_READY_WITHOUT_LIVE_PREREQUISITES"
      ],
      "statement_sha256": "16f11c1555e11ed71f77549f4ce2cfa3d20b5fae8f380f9d0f0634ea94d69aae",
      "statement_hash_class": "UPSTREAM_CANONICAL_HASH",
      "claim_class": "PROVED_THEOREM",
      "conditional": false,
      "ownership_record_sha256": "66f1780927264eab190ee060e7c43a8cf059d2988bec232824ab472a2e0c44c2",
      "coverage_status": "BOUND",
      "typed_outcome_binding_status": "DEFERRED_TO_WP4",
      "crosswalk_record_sha256": "d5ea652abd85480147c1447a582cabe78bcf3cd80a5976edaa734373126f21be"
    },
    {
      "theorem_id": "T131",
      "canonical_name": "undefined_is_not_zero",
      "canonical_owner": "V0_OSAP_V1_3_0",
      "primary_rule_id": "IPEC.RULE.DOMAIN.001",
      "rule_ids": [
        "IPEC.RULE.DOMAIN.001"
      ],
      "supporting_theorem_ids": [],
      "diagnostic_codes": [
        "UNDEFINED_DOMAIN_COERCED_TO_NUMERIC",
        "READY_VALUE_MISSING_NUMERIC"
      ],
      "statement_sha256": "37dd0964fb46fb2e5644b41a9ed5f24ed47c98d98adace0a205d4c41f449f923",
      "statement_hash_class": "UPSTREAM_CANONICAL_HASH",
      "claim_class": "PROVED_THEOREM",
      "conditional": false,